What is the actual reason of Chatrapati Shivaji Maharaj's death?,https://www.quora.com/What-is-the-actual-reason-of-Chatrapati-Shivaji-Maharajs-death
Who killed Shivaji Maharaj?,https://www.quora.com/Who-killed-Shivaji-Maharaj-2
Why do the Marathi people have respect for Shivaji Maharaj? How Maratha King protected India from Mughals?,https://www.quora.com/Why-do-the-Marathi-people-have-respect-for-Shivaji-Maharaj-How-Maratha-King-protected-India-from-Mughals
"""What is the best book to read on Shivaji Maharaj regarding his life adventures/stories ?""",https://www.quora.com/What-is-the-best-book-to-read-on-Shivaji-Maharaj-regarding-his-life-adventures-stories
Why is Maharashtra obsessed with Shivaji Maharaj?,https://www.quora.com/Why-is-Maharashtra-obsessed-with-Shivaji-Maharaj
What are some rare unknown facts about Chhatrapati Shivaji?,https://www.quora.com/What-are-some-rare-unknown-facts-about-Chhatrapati-Shivaji
Why do Marathi people admire Chhatrapati Shivaji Maharaj so much?,https://www.quora.com/Why-do-Marathi-people-admire-Chhatrapati-Shivaji-Maharaj-so-much
What are some interesting/inspirational stories about Chatrapati Shivaji Maharaj?,https://www.quora.com/What-are-some-interesting-inspirational-stories-about-Chatrapati-Shivaji-Maharaj
Why Hindu Kings like Shivaji Maharaj are less known by current generation?,https://www.quora.com/Why-Hindu-Kings-like-Shivaji-Maharaj-are-less-known-by-current-generation
How did Shivaji Maharaj die?,https://www.quora.com/How-did-Shivaji-Maharaj-die-1
How many statues of shivaji maharaj are there in the world?,https://www.quora.com/How-many-statues-of-shivaji-maharaj-are-there-in-the-world
How many wives did Chhatrapati Shivaji have?,https://www.quora.com/How-many-wives-did-Chhatrapati-Shivaji-have
Why did Shivaji Maharaj had 8 wives?,https://www.quora.com/Why-did-Shivaji-Maharaj-had-8-wives
How does Pakistan see Shivaji Maharaj?,https://www.quora.com/How-does-Pakistan-see-Shivaji-Maharaj
Are there any relatives of Chhatrapati Shivaji Maharaj alive?,https://www.quora.com/Are-there-any-relatives-of-Chhatrapati-Shivaji-Maharaj-alive
Where is Shivaji Maharaj Sinhasan?,https://www.quora.com/Where-is-Shivaji-Maharaj-Sinhasan
Where is Shivaji Maharaj's sword now? How does it look?,https://www.quora.com/Where-is-Shivaji-Maharajs-sword-now-How-does-it-look
Why are Indian people so proud of Shivaji Maharaj empire ?,https://www.quora.com/Why-are-Indian-people-so-proud-of-Shivaji-Maharaj-empire
How did Shivaji Maharaj look?,https://www.quora.com/How-did-Shivaji-Maharaj-look
